{
  "schemaVersion": "1.0.0",
  "generatedAt": "2026-10-05",
  "scope": "Tre naturpiloter. Foreløpig skrivebordskontroll med eksplisitte kunnskapshull; ingen nasjonal eller målt naturtapsanalyse.",
  "sources": [
    {
      "id": "gis-gromstul-naturtyper_hb13-0",
      "title": "naturtyper_hb13_alle – foreløpig søk gromstul",
      "publisher": "Miljødirektoratet",
      "url": "https://kart.miljodirektoratet.no/arcgis/rest/services/naturtyper_hb13/MapServer/0/query?f=json&where=1%3D1&geometry=%7B%22xmin%22%3A9.500617623875113%2C%22ymin%22%3A59.26547333703958%2C%22xmax%22%3A9.537731197091905%2C%22ymax%22%3A59.28897634652845%2C%22spatialReference%22%3A%7B%22wkid%22%3A4326%7D%7D&geometryType=esriGeometryEnvelope&inSR=4326&spatialRel=esriSpatialRelIntersects&returnIdsOnly=true",
      "publishedAt": null,
      "documentDate": null,
      "accessedAt": "2026-10-01",
      "access": "api_response",
      "locator": "results: gromstul/naturtyper_hb13/0",
      "dateNote": "Publiseringsdato for dette datasettuttrekket ukjent. Objektenes kartleggingsår er separate.",
      "localEvidence": "research/natur/gis-screening.json"
    },
    {
      "id": "gis-gromstul-naturtyper_nin-0",
      "title": "naturtyper_nin_alle – foreløpig søk gromstul",
      "publisher": "Miljødirektoratet",
      "url": "https://kart.miljodirektoratet.no/arcgis/rest/services/naturtyper_nin/MapServer/0/query?f=json&where=1%3D1&geometry=%7B%22xmin%22%3A9.500617623875113%2C%22ymin%22%3A59.26547333703958%2C%22xmax%22%3A9.537731197091905%2C%22ymax%22%3A59.28897634652845%2C%22spatialReference%22%3A%7B%22wkid%22%3A4326%7D%7D&geometryType=esriGeometryEnvelope&inSR=4326&spatialRel=esriSpatialRelIntersects&returnIdsOnly=true",
      "publishedAt": null,
      "documentDate": null,
      "accessedAt": "2026-10-01",
      "access": "api_response",
      "locator": "results: gromstul/naturtyper_nin/0",
      "dateNote": "Publiseringsdato for dette datasettuttrekket ukjent. Objektenes kartleggingsår er separate.",
      "localEvidence": "research/natur/gis-screening.json"
    },
    {
      "id": "gis-gromstul-naturtyper_nin-1",
      "title": "dekningskart_naturtyper_nin – foreløpig søk gromstul",
      "publisher": "Miljødirektoratet",
      "url": "https://kart.miljodirektoratet.no/arcgis/rest/services/naturtyper_nin/MapServer/1/query?f=json&where=1%3D1&geometry=%7B%22xmin%22%3A9.500617623875113%2C%22ymin%22%3A59.26547333703958%2C%22xmax%22%3A9.537731197091905%2C%22ymax%22%3A59.28897634652845%2C%22spatialReference%22%3A%7B%22wkid%22%3A4326%7D%7D&geometryType=esriGeometryEnvelope&inSR=4326&spatialRel=esriSpatialRelIntersects&returnIdsOnly=true",
      "publishedAt": null,
      "documentDate": null,
      "accessedAt": "2026-10-01",
      "access": "api_response",
      "locator": "results: gromstul/naturtyper_nin/1",
      "dateNote": "Publiseringsdato for dette datasettuttrekket ukjent. Objektenes kartleggingsår er separate.",
      "localEvidence": "research/natur/gis-screening.json"
    },
    {
      "id": "gis-hamar-naturtyper_nin-1",
      "title": "dekningskart_naturtyper_nin – foreløpig søk hamar",
      "publisher": "Miljødirektoratet",
      "url": "https://kart.miljodirektoratet.no/arcgis/rest/services/naturtyper_nin/MapServer/1/query?f=json&where=1%3D1&geometry=%7B%22xmin%22%3A11.25923287152275%2C%22ymin%22%3A60.83131956854819%2C%22xmax%22%3A11.275530418714263%2C%22ymax%22%3A60.85123743309795%2C%22spatialReference%22%3A%7B%22wkid%22%3A4326%7D%7D&geometryType=esriGeometryEnvelope&inSR=4326&spatialRel=esriSpatialRelIntersects&returnIdsOnly=true",
      "publishedAt": null,
      "documentDate": null,
      "accessedAt": "2026-10-01",
      "access": "api_response",
      "locator": "results: hamar/naturtyper_nin/1",
      "dateNote": "Publiseringsdato for dette datasettuttrekket ukjent. Objektenes kartleggingsår er separate.",
      "localEvidence": "research/natur/gis-screening.json"
    },
    {
      "id": "grom-permit-2025",
      "title": "Tillatelse – WS Computing AS, datasenter 1 Gromstul",
      "publisher": "Statsforvalteren i Vestfold og Telemark",
      "url": "https://webfileservice.nve.no/API/PublishedFiles/Download/dddf6fda-38d1-491f-abc5-9464c85e35eb/202422995/3446684",
      "publishedAt": null,
      "documentDate": "2025-08-25",
      "accessedAt": "2026-10-05",
      "access": "fulltext",
      "locator": "s. 1–4",
      "dateNote": "Dokumentdato kjent; publiseringsdato ukjent. PDF-tekst lest via nettverktøy; lokal nedlasting mislyktes.",
      "localEvidence": "research/natur/raw/gromstul-tillatelse-kildekontroll-2026-10-05.json"
    },
    {
      "id": "narvik-N2",
      "title": "PLA-001 Planinitiativ Kjølevannsanlegg Bjerkvik",
      "publisher": "Norconsult; publisert av Narvik kommune",
      "url": "https://www.narvik.kommune.no/_f/p1/ic10ceebf-27b0-4a5f-88ec-6fe256625887/pla-001-planinitiativ-kjolevannslosning-bjerkvik.pdf",
      "publishedAt": null,
      "documentDate": "2026-08-31",
      "accessedAt": "2026-10-01",
      "access": "fulltext",
      "locator": "Se utsagnets henvisning",
      "dateNote": "Seneste revisjonsrad på side 2 er 31.08.2026; løpende fot viser 19.08.2026. Versjonsavvik bevart.",
      "localEvidence": "research/natur/raw/narvik-kjolevann-planinitiativ.pdf",
      "version": "E05 i revisjonstabell; E04 i løpende fot"
    },
    {
      "id": "narvik-N3",
      "title": "Referat oppstartsmøte Kjølevannsanlegg Bjerkvik",
      "publisher": "Narvik kommune",
      "url": "https://www.narvik.kommune.no/_f/p1/i5c711bb0-acb3-400e-9995-8f972f1d26fc/referat-fra-oppstartsmote-detaljregulering-for-kjolevannsanlegg-bjerkvik.pdf",
      "publishedAt": null,
      "documentDate": "2026-08-31",
      "accessedAt": "2026-10-01",
      "access": "fulltext",
      "locator": "Se utsagnets henvisning",
      "dateNote": "Referatdatofelt 03.07.2026/31.08.2026; møte avholdt 03.07.2026.",
      "localEvidence": "research/natur/raw/narvik-kjolevann-oppstartsreferat.pdf",
      "version": null
    },
    {
      "id": "narvik-N5",
      "title": "Planbeskrivelse Skoglund–Lallasletta, NOKV-104-PNA-PLA-00004",
      "publisher": "Norconsult; publisert av Narvik kommune",
      "url": "https://www.narvik.kommune.no/_f/p1/ib5679dd3-4a12-4de3-be6a-5aea0c66e6f6/vedtatt-planbeskrivelse-komprimert-detaljregulering-for-skoglund-lallasletta.pdf",
      "publishedAt": null,
      "documentDate": "2025-10-17",
      "accessedAt": "2026-10-01",
      "access": "fulltext",
      "locator": "Se utsagnets henvisning",
      "dateNote": "PDF intern dato 17.10.2025; vedtak omtaler plan siste revisjon13.02.2026. PDF-dato erstattes ikke med vedtaksdato.",
      "localEvidence": "research/natur/raw/narvik-skoglund-planbeskrivelse.pdf",
      "version": "06"
    },
    {
      "id": "narvik-N6",
      "title": "Konsekvensutredning naturmangfold, NOKV-104-HSE-REP-00021",
      "publisher": "Norconsult; publisert av Narvik kommune",
      "url": "https://oldweb.narvik.kommune.no/_f/p28/i07f76ef7-28d1-45ab-9ff6-a68524e0d5e9/nokv-104-hse-rep-00021-konsekvensutredning-naturmangfold.pdf",
      "publishedAt": null,
      "documentDate": "2024-02-19",
      "accessedAt": "2026-10-01",
      "access": "fulltext",
      "locator": "Se utsagnets henvisning",
      "dateNote": "Historisk plangrep med hydrogen/ammoniakk på Skoglund og tunnel; ikke faglig godkjenning av kjølevann2026007.",
      "localEvidence": "research/natur/raw/narvik-skoglund-natur-2024.pdf",
      "version": "02"
    },
    {
      "id": "narvik-N7",
      "title": "Konsekvensutredning vannmiljø, NOKV-104-HSE-REP-00022",
      "publisher": "Norconsult; publisert av Narvik kommune",
      "url": "https://oldweb.narvik.kommune.no/_f/p28/i8a395588-f0b4-4e7e-8237-2651747427f8/nokv-104-hse-rep-00022-vannmiljo.pdf",
      "publishedAt": null,
      "documentDate": "2024-02-22",
      "accessedAt": "2026-10-01",
      "access": "fulltext",
      "locator": "Se utsagnets henvisning",
      "dateNote": "Historisk plangrep; lest for å kontrollere at sjøvann/desalinering/tunnel ikke er dagens kjølevannstiltak.",
      "localEvidence": "research/natur/raw/narvik-skoglund-vann-2024.pdf",
      "version": "02"
    },
    {
      "id": "plan-gromstul",
      "title": "Reguleringsplan for gbnr. 11/1 - datasenter Gromstul",
      "publisher": "Kommunalt planregister / Norkart",
      "url": "https://api.arealplaner.no/api/gi/kunder/skien4003/planomraader/4003/2017004",
      "publishedAt": null,
      "documentDate": null,
      "accessedAt": "2026-10-01",
      "access": "api_response",
      "locator": "Se utsagnets henvisning",
      "dateNote": "Geometridatum ikke eksplisitt deklarert; ikraftdato finnes i separat planmetadata.",
      "localEvidence": "research/raw/skien4003-2017004-geometry.json",
      "updatedAt": null
    },
    {
      "id": "plan-hamar",
      "title": "Detaljreguleringsplan for Heggvin næringspark",
      "publisher": "Kommunalt planregister / Norkart",
      "url": "https://api.arealplaner.no/api/gi/kunder/hamar3403/planomraader/3403/079500",
      "publishedAt": null,
      "documentDate": null,
      "accessedAt": "2026-10-01",
      "access": "api_response",
      "locator": "Se utsagnets henvisning",
      "dateNote": "Geometridatum ikke eksplisitt deklarert; ikraftdato finnes i separat planmetadata.",
      "localEvidence": "research/raw/hamar3403-079500-geometry.json",
      "updatedAt": "2024-11-26T00:00:00"
    },
    {
      "id": "u-grom-ku",
      "title": "Detaljreguleringsplan for datasenter i Skien kommune – Konsekvensutredning av naturmangfold",
      "publisher": "Norconsult for Statkraft AS; kopi hos Statsforvalteren",
      "url": "https://www.statsforvalteren.no/siteassets/fm-vestfold-og-telemark/miljo-og-klima/forurensning/dokumenter/2024/horinger/ws-computing-as/8.-konsekvensutredning-naturmangfold.pdf",
      "publishedAt": null,
      "documentDate": "2018-01-11",
      "accessedAt": "2026-10-01",
      "access": "reference_only",